{
  "schema_version": 2,
  "graph_id": "basic-graph",
  "seed": 42,
  "runtime": {
    "validation": false
  },
  "cpu_executor": {
    "mode": "worker_pool",
    "worker_count": 2
  },
  "policy": {
    "type": "fifo"
  },
  "trace": {
    "enabled": true,
    "capacity": 65536
  },
  "nodes": [
    {
      "id": "prepare",
      "name": "CPU preparation",
      "resource": "cpu",
      "priority": 0,
      "pack_id": "atlas.builtin",
      "task_id": "cpu_burn",
      "parameters": {
        "iterations": 100000
      }
    },
    {
      "id": "compute",
      "name": "Sliced GPU increment",
      "resource": "gpu",
      "priority": 0,
      "slice_workgroups": {
        "x": 16,
        "y": 1,
        "z": 1
      },
      "pack_id": "atlas.builtin",
      "task_id": "gpu_increment",
      "parameters": {
        "workgroups_x": 64,
        "workgroups_y": 1,
        "workgroups_z": 1
      }
    }
  ],
  "edges": [
    {
      "from": "prepare",
      "to": "compute"
    }
  ],
  "packs": []
}
