{
  "schema_version": 2,
  "graph_id": "all-kernels",
  "seed": 42,
  "runtime": {
    "validation": false
  },
  "cpu_executor": {
    "mode": "worker_pool",
    "worker_count": 2
  },
  "policy": {
    "type": "round_robin",
    "quantum": 1
  },
  "trace": {
    "enabled": true,
    "capacity": 65536
  },
  "nodes": [
    {
      "id": "cpu",
      "name": "CPU burn",
      "resource": "cpu",
      "priority": 1,
      "pack_id": "atlas.builtin",
      "task_id": "cpu_burn",
      "parameters": {
        "iterations": 100000
      }
    },
    {
      "id": "increment",
      "name": "GPU increment",
      "resource": "gpu",
      "priority": 2,
      "slice_workgroups": {
        "x": 8,
        "y": 1,
        "z": 1
      },
      "pack_id": "atlas.builtin",
      "task_id": "gpu_increment",
      "parameters": {
        "workgroups_x": 32,
        "workgroups_y": 1,
        "workgroups_z": 1
      }
    },
    {
      "id": "vector-add",
      "name": "Vector add",
      "resource": "gpu",
      "priority": 3,
      "slice_workgroups": {
        "x": 2,
        "y": 1,
        "z": 1
      },
      "pack_id": "atlas.builtin",
      "task_id": "vector_add",
      "parameters": {
        "element_count": 256,
        "left_value": 4,
        "right_value": 7
      }
    }
  ],
  "edges": [
    {
      "from": "cpu",
      "to": "increment"
    },
    {
      "from": "increment",
      "to": "vector-add"
    }
  ],
  "packs": []
}
